{
  "schema_version": "v2",
  "subsystem": "proc",
  "new_items": [
    {
      "item_key": "proc:/proc/consoles#open",
      "interface_id": "proc:/proc/consoles",
      "subsystem": "proc",
      "interface_type": "file_like",
      "operation": {
        "op_name": "open",
        "op_type": "path_open",
        "direction": "none"
      },
      "syscall_bindings": [
        {
          "syscall_name": "openat",
          "syscall_family": "fs_path",
          "syscall_nr_symbol": "__NR_openat",
          "call_form": "openat",
          "arguments": [
            {
              "name": "dirfd",
              "arg_role": "dirfd",
              "type_hint": "fd_dir"
            },
            {
              "name": "file",
              "arg_role": "path",
              "type_hint": "string"
            },
            {
              "name": "flags",
              "arg_role": "flags",
              "type_hint": "open_flags"
            },
            {
              "name": "mode",
              "arg_role": "mode",
              "type_hint": "open_mode"
            }
          ]
        }
      ],
      "access_paths": [
        "/proc/consoles"
      ],
      "source": {
        "file": "fs/proc/consoles.c",
        "line": 113,
        "symbol": "consoles_op",
        "symbol_kind": "proc_ops",
        "source_kind": "proc_create_seq",
        "related_symbols": [
          "consoles_op"
        ]
      },
      "attributes": {
        "resource_kind": "fd",
        "object_kind": "kernel_interface",
        "is_virtual": true,
        "is_path_based": true,
        "is_fd_based": true,
        "is_stateful": false
      },
      "subsystem_details": {
        "node_type": "file",
        "registration_kind": "proc_create_seq",
        "module_file": "fs/proc/consoles.c",
        "ops_symbol": "consoles_op",
        "parent_path": "/proc",
        "suggested_case_file": "proc_consoles__open.json"
      },
      "analysis": {
        "confidence": "medium",
        "evidence": [
          "discovered proc target /proc/consoles",
          "resolved 2 operations",
          "registration kind: proc_create_seq",
          "resolved ops symbol: consoles_op"
        ],
        "manual_todo": [
          "ops symbol consoles_op was not resolved",
          "using conservative open/read fallback because ops could not be resolved"
        ],
        "warnings": [
          "ops symbol consoles_op was not resolved",
          "using conservative open/read fallback because ops could not be resolved"
        ]
      }
    },
    {
      "item_key": "proc:/proc/consoles#read",
      "interface_id": "proc:/proc/consoles",
      "subsystem": "proc",
      "interface_type": "file_like",
      "operation": {
        "op_name": "read",
        "op_type": "fd_io",
        "direction": "out"
      },
      "syscall_bindings": [
        {
          "syscall_name": "read",
          "syscall_family": "fs_io",
          "syscall_nr_symbol": "__NR_read",
          "call_form": "read",
          "arguments": [
            {
              "name": "fd",
              "arg_role": "fd",
              "type_hint": "fd"
            },
            {
              "name": "buf",
              "arg_role": "buffer",
              "type_hint": "buffer[out]"
            },
            {
              "name": "count",
              "arg_role": "length",
              "type_hint": "len"
            }
          ]
        }
      ],
      "access_paths": [
        "/proc/consoles"
      ],
      "source": {
        "file": "fs/proc/consoles.c",
        "line": 113,
        "symbol": "consoles_op",
        "symbol_kind": "proc_ops",
        "source_kind": "proc_create_seq",
        "related_symbols": [
          "consoles_op"
        ]
      },
      "attributes": {
        "resource_kind": "fd",
        "object_kind": "kernel_interface",
        "is_virtual": true,
        "is_path_based": true,
        "is_fd_based": true,
        "is_stateful": false
      },
      "subsystem_details": {
        "node_type": "file",
        "registration_kind": "proc_create_seq",
        "module_file": "fs/proc/consoles.c",
        "ops_symbol": "consoles_op",
        "parent_path": "/proc",
        "suggested_case_file": "proc_consoles__read.json"
      },
      "analysis": {
        "confidence": "medium",
        "evidence": [
          "discovered proc target /proc/consoles",
          "resolved 2 operations",
          "registration kind: proc_create_seq",
          "resolved ops symbol: consoles_op"
        ],
        "manual_todo": [
          "ops symbol consoles_op was not resolved",
          "using conservative open/read fallback because ops could not be resolved"
        ],
        "warnings": [
          "ops symbol consoles_op was not resolved",
          "using conservative open/read fallback because ops could not be resolved"
        ]
      }
    },
    {
      "item_key": "proc:/proc/mounts#open",
      "interface_id": "proc:/proc/mounts",
      "subsystem": "proc",
      "interface_type": "symlink_like",
      "operation": {
        "op_name": "open",
        "op_type": "path_open",
        "direction": "none"
      },
      "syscall_bindings": [
        {
          "syscall_name": "openat",
          "syscall_family": "fs_path",
          "syscall_nr_symbol": "__NR_openat",
          "call_form": "openat",
          "arguments": [
            {
              "name": "dirfd",
              "arg_role": "dirfd",
              "type_hint": "fd_dir"
            },
            {
              "name": "file",
              "arg_role": "path",
              "type_hint": "string"
            },
            {
              "name": "flags",
              "arg_role": "flags",
              "type_hint": "open_flags"
            },
            {
              "name": "mode",
              "arg_role": "mode",
              "type_hint": "open_mode"
            }
          ]
        }
      ],
      "access_paths": [
        "/proc/mounts"
      ],
      "source": {
        "file": "fs/proc/root.c",
        "line": 371,
        "symbol": null,
        "symbol_kind": null,
        "source_kind": "proc_symlink",
        "related_symbols": []
      },
      "attributes": {
        "resource_kind": "fd",
        "object_kind": "kernel_interface",
        "is_virtual": true,
        "is_path_based": true,
        "is_fd_based": true,
        "is_stateful": false
      },
      "subsystem_details": {
        "node_type": "symlink",
        "registration_kind": "proc_symlink",
        "module_file": "fs/proc/root.c",
        "ops_symbol": null,
        "parent_path": "/proc",
        "suggested_case_file": "proc_mounts__open.json"
      },
      "analysis": {
        "confidence": "medium",
        "evidence": [
          "discovered proc target /proc/mounts",
          "resolved 2 operations",
          "registration kind: proc_symlink"
        ],
        "manual_todo": [
          "using conservative open/read fallback because ops could not be resolved"
        ],
        "warnings": [
          "using conservative open/read fallback because ops could not be resolved"
        ]
      }
    },
    {
      "item_key": "proc:/proc/mounts#read",
      "interface_id": "proc:/proc/mounts",
      "subsystem": "proc",
      "interface_type": "symlink_like",
      "operation": {
        "op_name": "read",
        "op_type": "fd_io",
        "direction": "out"
      },
      "syscall_bindings": [
        {
          "syscall_name": "read",
          "syscall_family": "fs_io",
          "syscall_nr_symbol": "__NR_read",
          "call_form": "read",
          "arguments": [
            {
              "name": "fd",
              "arg_role": "fd",
              "type_hint": "fd"
            },
            {
              "name": "buf",
              "arg_role": "buffer",
              "type_hint": "buffer[out]"
            },
            {
              "name": "count",
              "arg_role": "length",
              "type_hint": "len"
            }
          ]
        }
      ],
      "access_paths": [
        "/proc/mounts"
      ],
      "source": {
        "file": "fs/proc/root.c",
        "line": 371,
        "symbol": null,
        "symbol_kind": null,
        "source_kind": "proc_symlink",
        "related_symbols": []
      },
      "attributes": {
        "resource_kind": "fd",
        "object_kind": "kernel_interface",
        "is_virtual": true,
        "is_path_based": true,
        "is_fd_based": true,
        "is_stateful": false
      },
      "subsystem_details": {
        "node_type": "symlink",
        "registration_kind": "proc_symlink",
        "module_file": "fs/proc/root.c",
        "ops_symbol": null,
        "parent_path": "/proc",
        "suggested_case_file": "proc_mounts__read.json"
      },
      "analysis": {
        "confidence": "medium",
        "evidence": [
          "discovered proc target /proc/mounts",
          "resolved 2 operations",
          "registration kind: proc_symlink"
        ],
        "manual_todo": [
          "using conservative open/read fallback because ops could not be resolved"
        ],
        "warnings": [
          "using conservative open/read fallback because ops could not be resolved"
        ]
      }
    },
    {
      "item_key": "proc:/proc/fs#open",
      "interface_id": "proc:/proc/fs",
      "subsystem": "proc",
      "interface_type": "dir_like",
      "operation": {
        "op_name": "open",
        "op_type": "path_open",
        "direction": "none"
      },
      "syscall_bindings": [
        {
          "syscall_name": "openat",
          "syscall_family": "fs_path",
          "syscall_nr_symbol": "__NR_openat",
          "call_form": "openat",
          "arguments": [
            {
              "name": "dirfd",
              "arg_role": "dirfd",
              "type_hint": "fd_dir"
            },
            {
              "name": "file",
              "arg_role": "path",